{"id":"6603990","name":"Pat Sample","short_name":"Pat Sample","sortable_name":"Sample, Pat","avatar_url":"https://northgate.instructure.example/images/messages/avatar-50.png","title":null,"bio":null,"pronunciation":null,"primary_email":"pat.sample@mail.example","login_id":"pat.sample@mail.example","integration_id":null,"time_zone":"America/New_York","locale":null,"effective_locale":"en","calendar":{"ics":"https://northgate.instructure.example/feeds/calendars/user_PsObsNorthgate00000000000000000000000000.ics"},"lti_user_id":"a9b8c7d6e5f4a3b2c1d0e9f8a7b6c5d4e3f2a1b0","k5_user":false,"use_classic_font_in_k5":false}