{"id":"4833390","name":"Taylor Sample","short_name":"Taylor Sample","sortable_name":"Sample, Taylor","avatar_url":"https://canvas.northfield.example/images/messages/avatar-50.png","title":null,"bio":null,"pronunciation":null,"primary_email":"taylor.sample@students.northfield.example","login_id":"tsample","integration_id":null,"time_zone":"America/Chicago","locale":null,"effective_locale":"en","calendar":{"ics":"https://canvas.northfield.example/feeds/calendars/user_onRj6vgZETMWfUbsrisDgroT2HYHGLDtPgEGQydF.ics"},"lti_user_id":"a9d3f15ef4fc8e2245f4f2ed61f7488af31a296e","k5_user":false,"use_classic_font_in_k5":false}