{"id":"4820117","name":"Alex Sample","short_name":"Alex Sample","sortable_name":"Sample, Alex","avatar_url":"https://canvas.northfield.example/images/messages/avatar-50.png","title":null,"bio":null,"pronunciation":null,"primary_email":"alex.sample@students.northfield.example","login_id":"asample","integration_id":null,"time_zone":"America/Chicago","locale":null,"effective_locale":"en","calendar":{"ics":"https://canvas.northfield.example/feeds/calendars/user_Ask1r4LgYYQc3tzK8hToYfa1q5mdJkBhUxEMPXg7.ics"},"lti_user_id":"7b68fa70d445969345be3c3c8fe60bab3ab1b5ea","k5_user":false,"use_classic_font_in_k5":false}