{"id":"7710042","name":"Morgan Sample","short_name":"Morgan Sample","sortable_name":"Sample, Morgan","avatar_url":"https://canvas.lakeshore.example/images/messages/avatar-50.png","title":null,"bio":null,"pronunciation":null,"primary_email":"morgan.sample@lakeshore.example","login_id":"msample","integration_id":null,"time_zone":"America/Chicago","locale":null,"effective_locale":"en","calendar":{"ics":"https://canvas.lakeshore.example/feeds/calendars/user_aWJXxWRU0ON0uI3yt6qxZc9SH5tqkpbgy92gcG5U.ics"},"lti_user_id":"0a0f3411bad8f7c2b287c533a7ac5cdc7efdb0e7","k5_user":false,"use_classic_font_in_k5":false}