{"id":"8840217","name":"Casey Sample","short_name":"Casey Sample","sortable_name":"Sample, Casey","avatar_url":"https://riverbend.instructure.example/images/messages/avatar-50.png","title":null,"bio":null,"pronunciation":null,"primary_email":"casey.sample@students.riverbend.example","login_id":"csample","integration_id":null,"time_zone":"America/Denver","locale":null,"effective_locale":"en","calendar":{"ics":"https://riverbend.instructure.example/feeds/calendars/user_8Ydxh6nKJCNi83I3vWBvlT5v4ORfTLDyP7SF502p.ics"},"lti_user_id":"6c294e1860c0ea8092d5890a92de6475c9b704bd","k5_user":false,"use_classic_font_in_k5":false}