{"id":"4820990","name":"Pat Sample","short_name":"Pat Sample","sortable_name":"Sample, Pat","avatar_url":"https://canvas.northfield.example/images/messages/avatar-50.png","title":null,"bio":null,"pronunciation":null,"primary_email":"pat.sample@mail.example","login_id":"pat.sample@mail.example","integration_id":null,"time_zone":"America/Chicago","locale":null,"effective_locale":"en","calendar":{"ics":"https://canvas.northfield.example/feeds/calendars/user_PsObsNorthfield0000000000000000000000000.ics"},"lti_user_id":"5f0c1e2d3a4b5c6d7e8f90a1b2c3d4e5f6a7b8c9","k5_user":false,"use_classic_font_in_k5":false}